{
  "$schema": "https://json-schema.org/draft/2020-12/schema",
  "$id": "tutorial-spec.schema.json",
  "title": "TutorialSpec",
  "$comment": "v1.0. Output of packages/tutorial-compiler (Workflow -> TutorialSpec), consumed by the player (Phase 2) and the Remotion export (Phase 5). Design: docs/research/phase-2-together-tutorial-spec-design.md.",
  "description": "An interactive tutorial compiled from one Verified Workflow. Times are integer milliseconds; geometry is CSS pixels in page coordinates. Frames are derived only at video export: frame = round(ms / 1000 * fps).",
  "type": "object",
  "required": ["version", "workflow_id", "title", "viewport", "total_duration_ms", "scenes"],
  "additionalProperties": false,
  "properties": {
    "version": {
      "type": "string",
      "const": "1.0",
      "description": "Spec format version."
    },
    "workflow_id": { "type": "string", "format": "uuid" },
    "title": { "type": "string", "minLength": 1 },
    "description": { "type": ["string", "null"] },
    "viewport": {
      "$ref": "workflow.schema.json#/$defs/WorkflowViewport",
      "description": "The recording's viewport: the coordinate space of every bbox and point."
    },
    "fps": {
      "type": "integer",
      "minimum": 1,
      "maximum": 120,
      "default": 30,
      "description": "Frame rate for the video export only. The player ignores it."
    },
    "total_duration_ms": {
      "type": "integer",
      "minimum": 0,
      "description": "End of the last scene (start_ms + duration_ms)."
    },
    "scenes": {
      "type": "array",
      "minItems": 1,
      "items": { "$ref": "#/$defs/Scene" },
      "description": "One scene per workflow step, in step order."
    }
  },
  "$defs": {
    "Scene": {
      "title": "Scene",
      "type": "object",
      "description": "One workflow step. start_ms is on the tutorial timeline; every other time inside a scene (cursor, caption words) is relative to the scene's start.",
      "required": ["id", "step_seq", "start_ms", "duration_ms", "action", "caption", "recording"],
      "additionalProperties": false,
      "properties": {
        "id": { "type": "string", "minLength": 1 },
        "step_seq": { "type": "integer", "minimum": 1, "description": "seq of the workflow step this scene shows." },
        "title": { "type": ["string", "null"], "description": "Short label for the step list." },
        "start_ms": { "type": "integer", "minimum": 0, "description": "Scene start on the tutorial timeline." },
        "duration_ms": { "type": "integer", "minimum": 0 },
        "action": {
          "$ref": "common.schema.json#/$defs/Action",
          "description": "What the step does. value is copied from the workflow and is already masked if the step is sensitive."
        },
        "sensitive": {
          "type": "boolean",
          "default": false,
          "description": "The step typed a secret: show no typed text, only that something was entered."
        },
        "caption": { "$ref": "#/$defs/Caption" },
        "recording": { "$ref": "#/$defs/RecordingSlice" },
        "scroll": {
          "description": "Window scroll during the action, from the step. The highlight's viewport box is highlight.bbox - scroll.",
          "oneOf": [{ "$ref": "common.schema.json#/$defs/ScrollOffset" }, { "type": "null" }]
        },
        "camera": {
          "description": "Zoom and pan. Null: show the whole viewport.",
          "oneOf": [{ "$ref": "#/$defs/Camera" }, { "type": "null" }]
        },
        "cursor": {
          "description": "Null for steps without an element (navigate, a key press without target, wait).",
          "oneOf": [{ "$ref": "#/$defs/Cursor" }, { "type": "null" }]
        },
        "highlight": {
          "description": "Null for steps without an element.",
          "oneOf": [{ "$ref": "#/$defs/Highlight" }, { "type": "null" }]
        }
      }
    },
    "Caption": {
      "title": "Caption",
      "type": "object",
      "required": ["text"],
      "additionalProperties": false,
      "properties": {
        "text": { "type": "string", "minLength": 1, "description": "The step's instruction text, shown and narrated." },
        "words": {
          "description": "Word timings relative to the scene start, when known at compile time (Piper, Phase 5). Null when they only exist at playback (Web Speech boundary events).",
          "oneOf": [{ "type": "array", "items": { "$ref": "#/$defs/WordTiming" } }, { "type": "null" }]
        }
      }
    },
    "WordTiming": {
      "title": "WordTiming",
      "type": "object",
      "required": ["word", "start_ms", "end_ms"],
      "additionalProperties": false,
      "properties": {
        "word": { "type": "string", "minLength": 1 },
        "start_ms": { "type": "integer", "minimum": 0 },
        "end_ms": { "type": "integer", "minimum": 0 }
      }
    },
    "RecordingSlice": {
      "title": "RecordingSlice",
      "type": "object",
      "description": "The part of the workflow's rrweb recording this scene replays.",
      "required": ["start_ms", "end_ms"],
      "additionalProperties": false,
      "properties": {
        "start_ms": { "type": "integer", "minimum": 0, "description": "Milliseconds since the recording's first event." },
        "end_ms": { "type": "integer", "minimum": 0, "description": "Milliseconds since the recording's first event." },
        "baseline_snapshot_index": {
          "type": ["integer", "null"],
          "minimum": 0,
          "description": "Index (in the recording's event list) of the FullSnapshot to start from, so the slice renders on its own."
        }
      }
    },
    "Point": {
      "title": "Point",
      "type": "object",
      "description": "A point in CSS pixels, page coordinates.",
      "required": ["x", "y"],
      "additionalProperties": false,
      "properties": {
        "x": { "type": "number" },
        "y": { "type": "number" }
      }
    },
    "Camera": {
      "title": "Camera",
      "type": "object",
      "required": ["scale", "center"],
      "additionalProperties": false,
      "properties": {
        "scale": { "type": "number", "minimum": 1, "maximum": 3 },
        "center": { "$ref": "#/$defs/Point" },
        "easing": {
          "type": "string",
          "default": "cubic-bezier(0.22, 1, 0.36, 1)",
          "description": "CSS easing function for the pan/zoom."
        },
        "pan_duration_ms": { "type": "integer", "minimum": 0, "default": 450 }
      }
    },
    "ClickType": {
      "title": "ClickType",
      "enum": ["single", "double", "none"]
    },
    "Cursor": {
      "title": "Cursor",
      "type": "object",
      "description": "A cubic Bezier glide from path[0] to path[3]; times relative to the scene start.",
      "required": ["path", "start_ms", "end_ms", "click_type"],
      "additionalProperties": false,
      "properties": {
        "path": {
          "type": "array",
          "items": { "$ref": "#/$defs/Point" },
          "minItems": 4,
          "maxItems": 4,
          "description": "Bezier control points P0..P3."
        },
        "start_ms": { "type": "integer", "minimum": 0 },
        "end_ms": { "type": "integer", "minimum": 0 },
        "click_ms": { "type": ["integer", "null"], "minimum": 0 },
        "click_type": { "$ref": "#/$defs/ClickType" },
        "ripple": {
          "oneOf": [{ "$ref": "#/$defs/Ripple" }, { "type": "null" }],
          "description": "Click ripple. Null: no ripple."
        }
      }
    },
    "Ripple": {
      "title": "Ripple",
      "type": "object",
      "additionalProperties": false,
      "properties": {
        "radius": { "type": "number", "minimum": 0, "default": 24 },
        "color": { "type": "string", "default": "rgba(99, 102, 241, 0.4)" }
      }
    },
    "HighlightStyle": {
      "title": "HighlightStyle",
      "enum": ["pulsing_ring", "solid_box", "spotlight"]
    },
    "Highlight": {
      "title": "Highlight",
      "type": "object",
      "required": ["bbox", "style"],
      "additionalProperties": false,
      "properties": {
        "bbox": { "$ref": "common.schema.json#/$defs/BoundingBox" },
        "style": { "$ref": "#/$defs/HighlightStyle" },
        "padding": { "type": "number", "minimum": 0, "default": 8 },
        "color": { "type": "string", "default": "#4f46e5" }
      }
    }
  }
}
