{
  "version": "1.0",
  "workflow_id": "6f1c2a4e-1111-4b8a-9a1b-123456789abc",
  "title": "Create a repository in local Gitea",
  "description": "Create a repository named demo-repo in local Gitea initialized with README, .gitignore, and license",
  "viewport": {
    "width": 1280,
    "height": 800,
    "device_scale_factor": 1.0
  },
  "fps": 30,
  "total_duration_ms": 8650,
  "scenes": [
    {
      "id": "scene-1",
      "step_seq": 1,
      "title": "Create…",
      "start_ms": 0,
      "duration_ms": 1650,
      "action": {
        "type": "click",
        "value": null
      },
      "sensitive": false,
      "caption": {
        "text": "Open the + menu at the top right.",
        "words": [
          {
            "word": "Open",
            "start_ms": 100,
            "end_ms": 340
          },
          {
            "word": "the",
            "start_ms": 380,
            "end_ms": 560
          },
          {
            "word": "+",
            "start_ms": 600,
            "end_ms": 660
          },
          {
            "word": "menu",
            "start_ms": 700,
            "end_ms": 940
          },
          {
            "word": "at",
            "start_ms": 980,
            "end_ms": 1100
          },
          {
            "word": "the",
            "start_ms": 1140,
            "end_ms": 1320
          },
          {
            "word": "top",
            "start_ms": 1360,
            "end_ms": 1540
          },
          {
            "word": "right.",
            "start_ms": 1580,
            "end_ms": 1940
          }
        ]
      },
      "recording": {
        "start_ms": 2718,
        "end_ms": 3047,
        "baseline_snapshot_index": 0
      },
      "scroll": {
        "x": 0,
        "y": 0
      },
      "camera": {
        "scale": 1.35,
        "center": {
          "x": 1174.0,
          "y": 24.0
        },
        "easing": "cubic-bezier(0.22, 1, 0.36, 1)",
        "pan_duration_ms": 450
      },
      "cursor": {
        "path": [
          {
            "x": 640.0,
            "y": 400.0
          },
          {
            "x": 818.0,
            "y": 234.7
          },
          {
            "x": 996.0,
            "y": 129.3
          },
          {
            "x": 1174.0,
            "y": 24.0
          }
        ],
        "start_ms": 400,
        "end_ms": 1000,
        "click_ms": 1150,
        "click_type": "single",
        "ripple": {
          "radius": 24,
          "color": "rgba(99, 102, 241, 0.4)"
        }
      },
      "highlight": {
        "bbox": [
          1146,
          6,
          56,
          36
        ],
        "style": "pulsing_ring",
        "padding": 8,
        "color": "#4f46e5"
      }
    },
    {
      "id": "scene-2",
      "step_seq": 2,
      "title": "New Repository",
      "start_ms": 1650,
      "duration_ms": 1650,
      "action": {
        "type": "click",
        "value": null
      },
      "sensitive": false,
      "caption": {
        "text": "Click New Repository in the menu.",
        "words": null
      },
      "recording": {
        "start_ms": 3110,
        "end_ms": 3218,
        "baseline_snapshot_index": null
      },
      "scroll": {
        "x": 0,
        "y": 0
      },
      "camera": {
        "scale": 1.35,
        "center": {
          "x": 1122.0,
          "y": 63.0
        },
        "easing": "cubic-bezier(0.22, 1, 0.36, 1)",
        "pan_duration_ms": 450
      },
      "cursor": {
        "path": [
          {
            "x": 1174.0,
            "y": 24.0
          },
          {
            "x": 1156.7,
            "y": -3.0
          },
          {
            "x": 1139.3,
            "y": 30.0
          },
          {
            "x": 1122.0,
            "y": 63.0
          }
        ],
        "start_ms": 400,
        "end_ms": 1000,
        "click_ms": 1150,
        "click_type": "single",
        "ripple": {
          "radius": 24,
          "color": "rgba(99, 102, 241, 0.4)"
        }
      },
      "highlight": {
        "bbox": [
          1044,
          44,
          156,
          38
        ],
        "style": "pulsing_ring",
        "padding": 8,
        "color": "#4f46e5"
      }
    },
    {
      "id": "scene-3",
      "step_seq": 3,
      "title": "Repository Name *",
      "start_ms": 3300,
      "duration_ms": 2050,
      "action": {
        "type": "fill",
        "value": "demo-repo"
      },
      "sensitive": false,
      "caption": {
        "text": "Enter demo-repo as the repository name.",
        "words": null
      },
      "recording": {
        "start_ms": 3312,
        "end_ms": 3625,
        "baseline_snapshot_index": null
      },
      "scroll": {
        "x": 0,
        "y": 0
      },
      "camera": {
        "scale": 1.35,
        "center": {
          "x": 712.0,
          "y": 281.0
        },
        "easing": "cubic-bezier(0.22, 1, 0.36, 1)",
        "pan_duration_ms": 450
      },
      "cursor": {
        "path": [
          {
            "x": 1122.0,
            "y": 63.0
          },
          {
            "x": 985.3,
            "y": 95.7
          },
          {
            "x": 848.7,
            "y": 188.3
          },
          {
            "x": 712.0,
            "y": 281.0
          }
        ],
        "start_ms": 400,
        "end_ms": 1000,
        "click_ms": 1150,
        "click_type": "single",
        "ripple": {
          "radius": 24,
          "color": "rgba(99, 102, 241, 0.4)"
        }
      },
      "highlight": {
        "bbox": [
          519,
          262,
          386,
          38
        ],
        "style": "pulsing_ring",
        "padding": 8,
        "color": "#4f46e5"
      }
    },
    {
      "id": "scene-4",
      "step_seq": 4,
      "title": "Initialize Repository (Adds .gitignore, License and README)",
      "start_ms": 5350,
      "duration_ms": 1650,
      "action": {
        "type": "click",
        "value": null
      },
      "sensitive": false,
      "caption": {
        "text": "Check Initialize Repository to add .gitignore, License and README.",
        "words": null
      },
      "recording": {
        "start_ms": 3687,
        "end_ms": 4016,
        "baseline_snapshot_index": null
      },
      "scroll": {
        "x": 0,
        "y": 544
      },
      "camera": {
        "scale": 1.35,
        "center": {
          "x": 526.5,
          "y": 943.5
        },
        "easing": "cubic-bezier(0.22, 1, 0.36, 1)",
        "pan_duration_ms": 450
      },
      "cursor": {
        "path": [
          {
            "x": 712.0,
            "y": 281.0
          },
          {
            "x": 650.2,
            "y": 461.8
          },
          {
            "x": 588.3,
            "y": 702.7
          },
          {
            "x": 526.5,
            "y": 943.5
          }
        ],
        "start_ms": 400,
        "end_ms": 1000,
        "click_ms": 1150,
        "click_type": "single",
        "ripple": {
          "radius": 24,
          "color": "rgba(99, 102, 241, 0.4)"
        }
      },
      "highlight": {
        "bbox": [
          519,
          936,
          15,
          15
        ],
        "style": "pulsing_ring",
        "padding": 8,
        "color": "#4f46e5"
      }
    },
    {
      "id": "scene-5",
      "step_seq": 5,
      "title": "Create Repository",
      "start_ms": 7000,
      "duration_ms": 1650,
      "action": {
        "type": "click",
        "value": null
      },
      "sensitive": false,
      "caption": {
        "text": "Click Create Repository button to submit the form.",
        "words": null
      },
      "recording": {
        "start_ms": 4077,
        "end_ms": 4610,
        "baseline_snapshot_index": null
      },
      "scroll": {
        "x": 0,
        "y": 544
      },
      "camera": {
        "scale": 1.35,
        "center": {
          "x": 596.0,
          "y": 669.0
        },
        "easing": "cubic-bezier(0.22, 1, 0.36, 1)",
        "pan_duration_ms": 450
      },
      "cursor": {
        "path": [
          {
            "x": 526.5,
            "y": 943.5
          },
          {
            "x": 549.7,
            "y": 812.0
          },
          {
            "x": 572.8,
            "y": 740.5
          },
          {
            "x": 596.0,
            "y": 669.0
          }
        ],
        "start_ms": 400,
        "end_ms": 1000,
        "click_ms": 1150,
        "click_type": "single",
        "ripple": {
          "radius": 24,
          "color": "rgba(99, 102, 241, 0.4)"
        }
      },
      "highlight": {
        "bbox": [
          519,
          650,
          154,
          38
        ],
        "style": "pulsing_ring",
        "padding": 8,
        "color": "#4f46e5"
      }
    }
  ]
}
